<!DOCTYPE academics SYSTEM "6bc.dtd">

<academics>
<d_id>ACADEMICS</d_id>
<course c_id="btech">
<id>btech</id>
<student>
<rollno>1</rollno>
<name>
<fname>Ram</fname>
<lname>Sharma</lname>
</name>
</student>

<student>
<rollno>2</rollno>
<name>
<fname>Amy</fname>
<lname>Pohler</lname>
</name>
</student>

<student>
<rollno>3</rollno>
<name>
<fname>Tina</fname>
<lname>Fey</lname>
</name>
</student>

<student>
<rollno>4</rollno>
<name>
<fname>Vira</fname>
<lname>Farmiga</lname>
</name>
</student>
</course>

<course c_id="mca">
<id>mca</id>
<student>
<rollno>1</rollno>
<name>
<fname>Matt</fname>
<lname>Damon</lname>
</name>
</student>

<student>
<rollno>2</rollno>
<name>
<fname>Anthony</fname>
<lname>Hopkins</lname>
</name>
</student>

<student>
<rollno>3</rollno>
<name>
<fname>Leo</fname>
<lname>Tolstoy</lname>
</name>
</student>

<student>
<rollno>4</rollno>
<name>
<fname>Austin</fname>
<lname>Freeman</lname>
</name>
</student>
</course>
</academics>
